[
  {
    "schema_version": "1.0.0",
    "command_id": "JOB_METADATA_READ",
    "version": "1.0.0",
    "status": "DRAFT",
    "capability_id": "jenkins.job.metadata.read",
    "command_type": "QUERY",
    "transport": "MCP",
    "read_only": true,
    "external_business_side_effects": false,
    "allowed_roles": [
      "ADMIN",
      "NORMAL_USER"
    ],
    "view": "COMMON_QUERY_SAFE",
    "input_schema_ref": "query-contracts.schema.json#/$defs/JOB_METADATA_READInput",
    "output_schema_ref": "query-contracts.schema.json#/$defs/SafeEvidence",
    "binding_ref": null,
    "read_only_proof_ref": null,
    "parser_ref": null,
    "sensitivity_policy_ref": "SENSITIVE-DATA-V2",
    "timeout_seconds": 15,
    "retry_count": 0,
    "fallback_allowed": false
  },
  {
    "schema_version": "1.0.0",
    "command_id": "JOB_CONFIG_READ_SAFE",
    "version": "1.0.0",
    "status": "DRAFT",
    "capability_id": "jenkins.job.config.read_safe",
    "command_type": "QUERY",
    "transport": "MCP",
    "read_only": true,
    "external_business_side_effects": false,
    "allowed_roles": [
      "ADMIN",
      "NORMAL_USER"
    ],
    "view": "COMMON_QUERY_SAFE",
    "input_schema_ref": "query-contracts.schema.json#/$defs/JOB_CONFIG_READ_SAFEInput",
    "output_schema_ref": "query-contracts.schema.json#/$defs/SafeEvidence",
    "binding_ref": null,
    "read_only_proof_ref": null,
    "parser_ref": null,
    "sensitivity_policy_ref": "SENSITIVE-DATA-V2",
    "timeout_seconds": 15,
    "retry_count": 0,
    "fallback_allowed": false
  },
  {
    "schema_version": "1.0.0",
    "command_id": "SCM_REFERENCE_RESOLVE",
    "version": "1.0.0",
    "status": "DRAFT",
    "capability_id": "scm.reference.resolve",
    "command_type": "QUERY",
    "transport": "MCP",
    "read_only": true,
    "external_business_side_effects": false,
    "allowed_roles": [
      "ADMIN",
      "NORMAL_USER"
    ],
    "view": "COMMON_QUERY_SAFE",
    "input_schema_ref": "query-contracts.schema.json#/$defs/SCM_REFERENCE_RESOLVEInput",
    "output_schema_ref": "query-contracts.schema.json#/$defs/SafeEvidence",
    "binding_ref": null,
    "read_only_proof_ref": null,
    "parser_ref": null,
    "sensitivity_policy_ref": "SENSITIVE-DATA-V2",
    "timeout_seconds": 15,
    "retry_count": 0,
    "fallback_allowed": false
  },
  {
    "schema_version": "1.0.0",
    "command_id": "SCM_FILE_READ",
    "version": "1.0.0",
    "status": "DRAFT",
    "capability_id": "scm.file.read",
    "command_type": "QUERY",
    "transport": "MCP",
    "read_only": true,
    "external_business_side_effects": false,
    "allowed_roles": [
      "ADMIN",
      "NORMAL_USER"
    ],
    "view": "COMMON_QUERY_SAFE",
    "input_schema_ref": "query-contracts.schema.json#/$defs/SCM_FILE_READInput",
    "output_schema_ref": "query-contracts.schema.json#/$defs/SafeEvidence",
    "binding_ref": null,
    "read_only_proof_ref": null,
    "parser_ref": null,
    "sensitivity_policy_ref": "SENSITIVE-DATA-V2",
    "timeout_seconds": 15,
    "retry_count": 0,
    "fallback_allowed": false
  },
  {
    "schema_version": "1.0.0",
    "command_id": "LIBRARY_CONFIG_READ",
    "version": "1.0.0",
    "status": "DRAFT",
    "capability_id": "jenkins.library.config.read",
    "command_type": "QUERY",
    "transport": "MCP",
    "read_only": true,
    "external_business_side_effects": false,
    "allowed_roles": [
      "ADMIN",
      "NORMAL_USER"
    ],
    "view": "COMMON_QUERY_SAFE",
    "input_schema_ref": "query-contracts.schema.json#/$defs/LIBRARY_CONFIG_READInput",
    "output_schema_ref": "query-contracts.schema.json#/$defs/SafeEvidence",
    "binding_ref": null,
    "read_only_proof_ref": null,
    "parser_ref": null,
    "sensitivity_policy_ref": "SENSITIVE-DATA-V2",
    "timeout_seconds": 15,
    "retry_count": 0,
    "fallback_allowed": false
  },
  {
    "schema_version": "1.0.0",
    "command_id": "BUILD_METADATA_READ",
    "version": "1.0.0",
    "status": "DRAFT",
    "capability_id": "jenkins.build.metadata.read",
    "command_type": "QUERY",
    "transport": "MCP",
    "read_only": true,
    "external_business_side_effects": false,
    "allowed_roles": [
      "ADMIN",
      "NORMAL_USER"
    ],
    "view": "COMMON_QUERY_SAFE",
    "input_schema_ref": "query-contracts.schema.json#/$defs/BUILD_METADATA_READInput",
    "output_schema_ref": "query-contracts.schema.json#/$defs/SafeEvidence",
    "binding_ref": null,
    "read_only_proof_ref": null,
    "parser_ref": null,
    "sensitivity_policy_ref": "SENSITIVE-DATA-V2",
    "timeout_seconds": 15,
    "retry_count": 0,
    "fallback_allowed": false
  },
  {
    "schema_version": "1.0.0",
    "command_id": "BUILD_LOG_READ_SAFE",
    "version": "1.0.0",
    "status": "DRAFT",
    "capability_id": "jenkins.build.log.read_safe",
    "command_type": "QUERY",
    "transport": "MCP",
    "read_only": true,
    "external_business_side_effects": false,
    "allowed_roles": [
      "ADMIN",
      "NORMAL_USER"
    ],
    "view": "COMMON_QUERY_SAFE",
    "input_schema_ref": "query-contracts.schema.json#/$defs/BUILD_LOG_READ_SAFEInput",
    "output_schema_ref": "query-contracts.schema.json#/$defs/SafeEvidence",
    "binding_ref": null,
    "read_only_proof_ref": null,
    "parser_ref": null,
    "sensitivity_policy_ref": "SENSITIVE-DATA-V2",
    "timeout_seconds": 15,
    "retry_count": 0,
    "fallback_allowed": false
  },
  {
    "schema_version": "1.0.0",
    "command_id": "ARTIFACT_READ_SAFE",
    "version": "1.0.0",
    "status": "DRAFT",
    "capability_id": "jenkins.artifact.read_safe",
    "command_type": "QUERY",
    "transport": "MCP",
    "read_only": true,
    "external_business_side_effects": false,
    "allowed_roles": [
      "ADMIN",
      "NORMAL_USER"
    ],
    "view": "COMMON_QUERY_SAFE",
    "input_schema_ref": "query-contracts.schema.json#/$defs/ARTIFACT_READ_SAFEInput",
    "output_schema_ref": "query-contracts.schema.json#/$defs/SafeEvidence",
    "binding_ref": null,
    "read_only_proof_ref": null,
    "parser_ref": null,
    "sensitivity_policy_ref": "SENSITIVE-DATA-V2",
    "timeout_seconds": 15,
    "retry_count": 0,
    "fallback_allowed": false
  }
]
